instruction,output
Give a technical explanation of what is the difference between dense and sparse retrieval? Give examples where relevant.,"Sparse retrieval (BM25, TF-IDF) uses keyword matching with inverted indexes — fast and interpretable. Dense retrieval uses neural embeddings and ANN search — captures semantic similarity and handles paraphrasing. Hybrid RAG combines both using reciprocal rank fusion for best recall."
What is meant by what is the PEFT library? Provide a detailed answer.,"PEFT by HuggingFace simplifies applying LoRA, prefix tuning, prompt tuning, and IA3 to any HuggingFace model. Key functions: LoraConfig, get_peft_model (wraps model and freezes base), PeftModel.from_pretrained (loads adapter). Integrates with Trainer and SFTTrainer."
Briefly describe what is self-consistency prompting? Include relevant equations or pseudocode if helpful.,"Self-consistency (Wang et al., 2022) samples multiple diverse CoT reasoning paths for the same question and takes a majority vote on the final answer. Accuracy improves with more samples. It exploits the fact that correct reasoning paths tend to converge on the correct answer while incorrect paths diverge."
"In simple terms, what is what is full fine-tuning vs PEFT?",Full fine-tuning updates all model parameters — roughly 28 GB GPU memory for a 7B model at float16. PEFT (Parameter-Efficient Fine-Tuning) freezes most weights and trains a tiny subset. LoRA trains about 0.1-1% extra parameters achieving near full fine-tuning quality at a fraction of memory and compute cost.
What is meant by walk through LoRA fine-tuning step by step. Give examples where relevant.,"1. Load pretrained model with 4-bit quantization (QLoRA). 2. Define LoraConfig with r=16, alpha=32, targeting q, k, v, o projections. 3. Wrap model with get_peft_model — freezes base weights, adds LoRA matrices. 4. Tokenize dataset in chat format. 5. Train with SFTTrainer — only LoRA params (~0.4%) update. 6. Save the adapter (~50 MB vs 2 GB full model). 7. Merge or load adapter at inference."
What is meant by what is in-context learning? Be concise and precise.,In-context learning (ICL) is the ability of LLMs to perform new tasks from examples given in the prompt without weight updates. The model learns from the context at inference time. Performance scales with model size. Understanding of why ICL works is an active research area — hypotheses include implicit gradient descent and Bayesian inference.
I need help understanding what is the difference between GPT-2 and GPT-3?,GPT-2 has 1.5B parameters and was pretrained on WebText (~40 GB). GPT-3 scaled to 175B parameters on 300B tokens from Common Crawl and other sources. GPT-3 demonstrated few-shot in-context learning as an emergent capability absent in GPT-2. Scale bridged the gap from a text completer to a general-purpose assistant.
What is meant by what is QLoRA? Explain technically.,"QLoRA (Dettmers et al., 2023) combines 4-bit NF4 (NormalFloat4) quantization of the frozen base model with LoRA adapters trained in bfloat16. Double quantization further compresses quantization constants. With paged optimizers, a 7B model can be fine-tuned on a single 16 GB T4 GPU. Quality is close to 16-bit LoRA."
I need help understanding what is tokenization? Give examples.,"Tokenization converts raw text into a sequence of integer IDs. Modern LLMs use subword tokenization: BPE (Byte-Pair Encoding, used in GPT), WordPiece (BERT), or SentencePiece (LLaMA). Subword methods balance vocabulary size with the ability to represent rare words by splitting them into common subword units."
Can you explain what is PEFT prefix tuning?,"Prefix tuning (Li & Liang, 2021) prepends a sequence of trainable continuous vectors (the prefix) to the key and value matrices at every Transformer layer. Only the prefix parameters are trained; base model is frozen. More expressive than prompt tuning but with more parameters."
I need help understanding what is PEFT prefix tuning?,"Prefix tuning (Li & Liang, 2021) prepends a sequence of trainable continuous vectors (the prefix) to the key and value matrices at every Transformer layer. Only the prefix parameters are trained; base model is frozen. More expressive than prompt tuning but with more parameters."
What is prompt engineering? Explain technically.,"Prompt engineering designs input prompts to elicit desired LLM outputs. Techniques: zero-shot (direct instruction), few-shot (k demonstrations), chain-of-thought (step-by-step reasoning), system prompts (role/persona), structured output prompting (JSON schema), self-consistency (majority vote over multiple CoT paths)."
"In simple terms, what is what is Ollama? Include relevant equations or pseudocode if helpful.","Ollama is a tool for running LLMs locally on consumer hardware. Supports quantized GGUF versions of LLaMA-3, Mistral, Gemma, and Phi models. Provides an OpenAI-compatible API. Useful for privacy-sensitive or offline use cases."
Briefly describe what is the feed-forward sublayer in a Transformer?,"The position-wise FFN applies two linear layers with a non-linearity: FFN(x) = max(0, xW_1 + b_1)W_2 + b_2. Typically d_ff = 4 * d_model. Some models use SwiGLU or GEGLU activations. The FFN operates independently on each position and is responsible for memorizing factual knowledge."
Please describe what is hallucination in LLMs?,"Hallucination occurs when an LLM generates plausible-sounding but factually incorrect or unsupported content. Types: intrinsic (contradicts source), extrinsic (adds info not in source). Causes: spurious correlations, overconfidence, insufficient grounding. Mitigations: RAG, RLHF, self-consistency, factuality-focused fine-tuning."
What is Ollama? Provide a detailed answer.,"Ollama is a tool for running LLMs locally on consumer hardware. Supports quantized GGUF versions of LLaMA-3, Mistral, Gemma, and Phi models. Provides an OpenAI-compatible API. Useful for privacy-sensitive or offline use cases."
What is meant by what is Groq?,"Groq is an inference platform with custom LPU hardware delivering extremely fast token generation (200-400 tokens/second). Provides a free API tier supporting LLaMA-3, Mixtral, and Gemma models. Useful for rapid prototyping where low latency matters."
Please describe what is classifier-free guidance? Give examples where relevant.,"CFG trains a single model for both conditional and unconditional generation by randomly dropping the class condition during training. At inference, the output is extrapolated: output = uncond + w*(cond - uncond) where w > 1 increases adherence to the condition at the cost of diversity. Used in Stable Diffusion."
"For a university exam, explain compare LoRA and full fine-tuning. Provide a detailed answer.",Full fine-tuning updates all parameters needing roughly 28 GB GPU for a 7B model. LoRA adds about 0.1-0.4% extra params needing roughly 6 GB. Quality is comparable for most tasks. LoRA adapters are modular and swappable — multiple tasks can share one base model. LoRA also avoids catastrophic forgetting because base weights are frozen.
"For a university exam, explain what is the difference between RAG and fine-tuning? Provide a detailed answer.","RAG retrieves external knowledge at inference without changing weights — ideal for frequently updated facts, private documents, and reducing hallucination. Fine-tuning updates weights on domain data — ideal for style, format, and behavioral changes. RAG has higher inference latency; fine-tuning has higher training cost. They are complementary: fine-tune for format, use RAG for facts."
"For a university exam, explain what is the posterior collapse problem in VAEs?","Posterior collapse occurs when the decoder ignores z and the encoder collapses to the prior (KL = 0). The model degenerates to a decoder-only model. Solutions: KL annealing (gradually increase KL weight), beta-VAE, free bits, or using a weaker decoder."
"In simple terms, what is what is flash attention? Give examples where relevant.","FlashAttention (Dao et al., 2022) is an IO-aware exact attention algorithm that tiles Q, K, V to avoid materializing the full N by N attention matrix in HBM. Reduces memory from O(N^2) to O(N) and is 2-4x faster due to reduced memory bandwidth. FlashAttention-2 further optimizes parallelism."
What is paged AdamW? Include relevant equations or pseudocode if helpful.,"Paged AdamW (bitsandbytes) keeps optimizer states in CPU RAM and pages them to GPU only when needed. Standard AdamW stores moment tensors on GPU (2x model size). Paged AdamW reduces peak GPU memory significantly, enabling larger batch sizes. Used with QLoRA."
Briefly describe what is cross-attention? Include relevant equations or pseudocode if helpful.,"Cross-attention allows the decoder to attend over encoder representations. Q comes from the decoder, K and V come from the encoder. This enables the decoder to look up relevant parts of the encoded input, fundamental in seq2seq tasks like translation."
"For a university exam, explain when is the assignment submission deadline?",The combined deadline for Assignment 1 and Assignment 2 is 5th April 2026 at 9:00 PM IST. Demonstrations and Vivas are scheduled after submission.
What is meant by what is multi-head attention? Give examples where relevant.,"Multi-head attention runs h attention heads in parallel, each with independent W_Q, W_K, W_V projections of dimension d_k = d_model/h. Outputs are concatenated then linearly projected: MultiHead(Q,K,V) = Concat(head_1,...,head_h)W_O. Different heads can attend to different positional and semantic patterns."
Define the following: what is a vector database?,"A vector database stores embeddings and supports approximate nearest-neighbor search. Options: ChromaDB (easy Python API, local persistence), FAISS (C++ optimized, billion-scale, IVF/HNSW), Pinecone (managed cloud), Qdrant (Rust, production-grade with payload filters), Weaviate (GraphQL interface)."
Define what is tokenization?,"Tokenization converts raw text into a sequence of integer IDs. Modern LLMs use subword tokenization: BPE (Byte-Pair Encoding, used in GPT), WordPiece (BERT), or SentencePiece (LLaMA). Subword methods balance vocabulary size with the ability to represent rare words by splitting them into common subword units."
I need help understanding what is full fine-tuning vs PEFT?,Full fine-tuning updates all model parameters — roughly 28 GB GPU memory for a 7B model at float16. PEFT (Parameter-Efficient Fine-Tuning) freezes most weights and trains a tiny subset. LoRA trains about 0.1-1% extra parameters achieving near full fine-tuning quality at a fraction of memory and compute cost.
What is the ELBO? Provide a detailed answer.,"ELBO = Evidence Lower BOund = E_q[log p(x|z)] - KL(q(z|x)||p(z)). Maximizing the ELBO simultaneously maximizes reconstruction quality and keeps the approximate posterior q(z|x) close to the prior N(0,I). The ELBO lower-bounds log p(x), so maximizing it indirectly maximizes marginal likelihood."
What is meant by what is the reparameterization trick in VAEs? Be concise and precise.,"Sampling z ~ N(mu, sigma^2) is non-differentiable. The reparameterization trick rewrites z = mu + sigma * epsilon where epsilon ~ N(0,1). Gradients flow through mu and sigma deterministically; epsilon carries the randomness. This enables backpropagation through the sampling step."
"For a university exam, explain what is the feed-forward sublayer in a Transformer? Explain with clear definitions.","The position-wise FFN applies two linear layers with a non-linearity: FFN(x) = max(0, xW_1 + b_1)W_2 + b_2. Typically d_ff = 4 * d_model. Some models use SwiGLU or GEGLU activations. The FFN operates independently on each position and is responsible for memorizing factual knowledge."
Briefly describe what is cross-entropy loss? For a GenAI student.,"Cross-entropy loss measures the difference between the predicted probability distribution and the true distribution: L = -sum_i y_i * log(p_i). For language modeling, it is the negative log-likelihood of the correct next token. Minimizing cross-entropy is equivalent to maximizing likelihood."
Define what is the softmax function?,"Softmax converts a vector of real numbers into a probability distribution: softmax(z_i) = exp(z_i) / sum_j(exp(z_j)). It ensures all outputs are positive and sum to 1. Used in classification heads, attention score normalization, and the final token prediction layer of LLMs."
Please explain what are BLEU and ROUGE metrics? Explain with clear definitions.,"BLEU (Bilingual Evaluation Understudy) measures n-gram precision between generated and reference text, used mainly for translation. ROUGE (Recall-Oriented Understudy for Gisting Evaluation) measures recall and F1 of n-gram overlap, used mainly for summarization. ROUGE-L uses longest common subsequence. Both are reference-based and miss semantic equivalence."
"For a university exam, explain what is positional encoding? Explain technically.","Since self-attention is permutation-invariant, positional encoding injects order information. Original Transformer uses fixed sinusoids: PE(pos,2i)=sin(pos/10000^(2i/d)), PE(pos,2i+1)=cos(pos/10000^(2i/d)). BERT/GPT use learned embeddings. LLaMA uses RoPE (Rotary Position Embedding), which applies rotation matrices to Q and K, enabling relative position information and length generalization."
Briefly describe what is likelihood-based training? For a Generative AI course student.,"Likelihood-based training maximizes log P(x; theta) over the training set. VAEs maximize the ELBO (a lower bound), autoregressive models maximize exact log-likelihood, and normalizing flows maximize exact likelihood via invertible transformations. Diffusion models optimize a variational bound on log-likelihood."
What is meant by what is the attention mechanism in neural networks? Give examples.,"Attention allows a model to weight different parts of the input differently when producing each output element. It computes a context vector as a weighted sum of value vectors, where weights are derived from the similarity between a query and key vectors. Attention removes the bottleneck of fixed-size encodings in seq2seq models."
What is meant by explain the RAG pipeline step by step.,"1. Ingestion: load and clean documents. 2. Chunking: split into overlapping chunks (e.g., 512 tokens, 50 overlap). 3. Embedding: encode chunks with a sentence-transformer model. 4. Storage: index in ChromaDB or FAISS. 5. Retrieval: embed the query, find top-k similar chunks via ANN. 6. Augmentation: inject retrieved chunks into the LLM prompt. 7. Generation: LLM produces a grounded answer."
What is knowledge distillation? Provide a detailed answer.,Knowledge distillation trains a smaller student model to mimic a larger teacher model. The student is trained on the teacher soft probability outputs (dark knowledge) rather than hard labels. DistilBERT is 40% smaller than BERT with 97% of its performance. Useful for deploying models on edge devices.
I need help understanding what is the forward and reverse process in diffusion models? Provide a detailed answer.,"Forward: q(x_t|x_{t-1}) = N(x_t; sqrt(1-beta_t)*x_{t-1}, beta_t*I) adds Gaussian noise at each step. Reverse: learned p_theta(x_{t-1}|x_t) denoises step by step. The network predicts the noise epsilon_theta(x_t, t) and the loss is MSE between predicted and actual noise."
Please explain what is dropout regularization? Explain technically.,"Dropout randomly sets a fraction p of neurons to zero during training, forcing the network to learn redundant representations. Acts as an ensemble of many sub-networks. Reduces overfitting on small datasets. At inference, all neurons are active and outputs are scaled by (1-p). Less commonly used in modern LLMs."
Define what is prompt tuning?,"Prompt tuning (Lester et al., 2021) prepends a small number of trainable token embeddings to the input at the embedding layer. The rest of the model is frozen. Simpler than prefix tuning. Performance approaches full fine-tuning at large model scales (10B+ parameters)."
What is the feed-forward sublayer in a Transformer? Provide a detailed answer.,"The position-wise FFN applies two linear layers with a non-linearity: FFN(x) = max(0, xW_1 + b_1)W_2 + b_2. Typically d_ff = 4 * d_model. Some models use SwiGLU or GEGLU activations. The FFN operates independently on each position and is responsible for memorizing factual knowledge."
"For a university exam, explain what is the difference between closed-book and open-book QA?",Closed-book QA relies solely on model weights — the model answers from memory. Open-book QA provides documents or uses RAG to retrieve relevant passages — the model grounds answers in context. Open-book QA reduces hallucination and allows answering questions outside the training distribution.
What is full fine-tuning vs PEFT?,Full fine-tuning updates all model parameters — roughly 28 GB GPU memory for a 7B model at float16. PEFT (Parameter-Efficient Fine-Tuning) freezes most weights and trains a tiny subset. LoRA trains about 0.1-1% extra parameters achieving near full fine-tuning quality at a fraction of memory and compute cost.
What is quantization in LLMs? Provide a detailed answer.,"Quantization reduces model precision from float32 or float16 to int8, int4, or lower, shrinking memory footprint and speeding up inference. GPTQ uses post-training quantization with calibration data. bitsandbytes enables 4-bit NF4 QLoRA training. Quality loss is minimal at int8 and modest at int4."
I need help understanding what is the GAN training objective?,"min_G max_D E[log D(x)] + E[log(1 - D(G(z)))]. D maximizes log-probabilities for real data and log(1-p) for fakes. G minimizes log(1 - D(G(z))), or equivalently maximizes log D(G(z)) in the non-saturating version to avoid vanishing gradients early in training."
What is meant by what is Byte-Pair Encoding? Explain technically.,"BPE starts with a character vocabulary and iteratively merges the most frequent adjacent pair of tokens into a new token, building a vocabulary of subword units. The process repeats until the vocabulary reaches a target size. GPT and GPT-2 use BPE. BPE handles rare words by splitting them into familiar subwords."
"For an AI course student, what is what is cross-entropy loss? Be concise.","Cross-entropy loss measures the difference between the predicted probability distribution and the true distribution: L = -sum_i y_i * log(p_i). For language modeling, it is the negative log-likelihood of the correct next token. Minimizing cross-entropy is equivalent to maximizing likelihood."
Give a technical explanation of what is RAG?,"RAG (Retrieval-Augmented Generation, Lewis et al., 2020) enhances generation by retrieving relevant documents at inference time. Pipeline: offline — chunk documents, embed chunks, store in vector DB; online — embed query, retrieve top-k similar chunks by ANN search, inject into prompt, LLM generates a grounded answer. Reduces hallucinations without retraining."
I need help understanding what is in-context learning? Explain technically.,In-context learning (ICL) is the ability of LLMs to perform new tasks from examples given in the prompt without weight updates. The model learns from the context at inference time. Performance scales with model size. Understanding of why ICL works is an active research area — hypotheses include implicit gradient descent and Bayesian inference.
"For an AI course student, what is what is context length and why does it matter? Be concise.","Context length (or context window) is the maximum number of tokens the model can attend to at once. Longer context enables processing entire documents, multi-turn conversations, and few-shot prompting with many examples. LLaMA-3 supports 128K tokens. Long context requires flash attention and positional encoding that generalizes (e.g., RoPE with YaRN)."
"In simple terms, what is what is flash attention? Be concise and precise.","FlashAttention (Dao et al., 2022) is an IO-aware exact attention algorithm that tiles Q, K, V to avoid materializing the full N by N attention matrix in HBM. Reduces memory from O(N^2) to O(N) and is 2-4x faster due to reduced memory bandwidth. FlashAttention-2 further optimizes parallelism."
What is self-consistency prompting? Explain with clear definitions.,"Self-consistency (Wang et al., 2022) samples multiple diverse CoT reasoning paths for the same question and takes a majority vote on the final answer. Accuracy improves with more samples. It exploits the fact that correct reasoning paths tend to converge on the correct answer while incorrect paths diverge."
"As an AI student, explain explain the RAG pipeline step by step. Give examples where relevant.","1. Ingestion: load and clean documents. 2. Chunking: split into overlapping chunks (e.g., 512 tokens, 50 overlap). 3. Embedding: encode chunks with a sentence-transformer model. 4. Storage: index in ChromaDB or FAISS. 5. Retrieval: embed the query, find top-k similar chunks via ANN. 6. Augmentation: inject retrieved chunks into the LLM prompt. 7. Generation: LLM produces a grounded answer."
"For a university exam, explain what is gradient checkpointing? Give examples where relevant.","Gradient checkpointing reduces activation memory by not storing all intermediate activations during the forward pass. During backprop, discarded activations are recomputed on the fly. Trades about 30% extra compute for a large reduction in memory, enabling larger batch sizes or longer sequences."
I need help understanding what is the attention mechanism in neural networks? Explain with definitions.,"Attention allows a model to weight different parts of the input differently when producing each output element. It computes a context vector as a weighted sum of value vectors, where weights are derived from the similarity between a query and key vectors. Attention removes the bottleneck of fixed-size encodings in seq2seq models."
Can you explain what is a GAN? Give examples where relevant.,"A GAN (Goodfellow et al., 2014) consists of a Generator G(z) that maps noise z to data-like samples, and a Discriminator D(x) that classifies real vs fake. G is trained to fool D; D is trained to distinguish them. At equilibrium, G produces samples indistinguishable from real data."
"As an AI student, explain what are chunking strategies for RAG? Give examples where relevant.","Strategies: (1) Fixed-size with overlap (e.g., 512 tokens, 50-token overlap) — simple but may split sentences; (2) Recursive character splitting — splits at paragraphs, then sentences, then words; (3) Semantic chunking — splits when embedding similarity drops; (4) Document-structure-aware — splits at headers/sections. Overlap prevents context loss at chunk boundaries."
Give a technical explanation of what topics are covered in the Generative AI and LLMs course?,"Topics: Generative models (VAE, GAN, Diffusion), Transformer architecture, LLM pretraining, Prompt engineering, Fine-tuning methods (LoRA, QLoRA, RLHF, DPO), RAG systems, Vector databases, Evaluation metrics, and practical deployment on Colab."
Briefly describe what is the AdamW optimizer? Include relevant equations or pseudocode if helpful.,"AdamW (Loshchilov & Hutter, 2019) decouples weight decay from the adaptive gradient update. Standard Adam applies weight decay through the gradient (L2 regularization), conflating it with adaptive scaling. AdamW applies weight decay directly to weights, making regularization more effective. Standard choice for LLM training."
What is meant by what are the main families of generative models? Explain technically.,"The four main families are: (1) GANs — adversarial generator-discriminator training; (2) VAEs — encoder-decoder with a probabilistic latent space; (3) Diffusion models — iterative denoising from Gaussian noise; (4) Autoregressive models — predict the next token given previous tokens (e.g., GPT)."
Please explain what is ReAct prompting? Include relevant equations or pseudocode if helpful.,"ReAct (Yao et al., 2022) interleaves Thought (reasoning step), Action (tool call: search or calculator), and Observation (tool result) cycles. The LLM decides what to do, calls a tool, observes the result, and iterates. Grounding reasoning in tool outputs reduces hallucinations. ReAct is the foundation of LLM agent loops."
"In simple terms, what is what is the difference between autoregressive and diffusion generation? Give examples where relevant.","Autoregressive models (GPT) generate token by token left to right — exact likelihood but sequential and slow for long sequences. Diffusion models denoise from Gaussian noise in T steps — parallel denoising for images, better quality but typically requires many steps. Diffusion-based text generation (e.g., MDLM) is an active research area."
"For an AI course student, what is what is the softmax function?","Softmax converts a vector of real numbers into a probability distribution: softmax(z_i) = exp(z_i) / sum_j(exp(z_j)). It ensures all outputs are positive and sum to 1. Used in classification heads, attention score normalization, and the final token prediction layer of LLMs."
Please explain what is instruction tuning? Provide a detailed answer.,"Instruction tuning fine-tunes LLMs on diverse (instruction, output) pairs covering many tasks. Models learn to follow natural language instructions zero-shot. FLAN, Alpaca, Vicuna, and OpenHermes are examples. Instruction tuning drastically improves zero-shot generalization across unseen tasks."
Briefly describe what are the assessment components of the course? Include relevant equations or pseudocode if helpful.,"Assessment breakdown: Assignment 1 (RAG System) 30%, Assignment 2 (Fine-Tuning) 30%, Viva 10%, Mid-semester exam 15%, End-semester exam 15%. Total 100%."
