instruction,output
What is meant by what is weight tying in language models?,"Weight tying shares the embedding matrix between the input token embedding layer and the output projection layer (lm_head). Since both map between token space and representation space, sharing weights reduces parameter count and often improves perplexity. Used in GPT-2 and many smaller LLMs."
Please describe what is the posterior collapse problem in VAEs? Include relevant equations or pseudocode if helpful.,"Posterior collapse occurs when the decoder ignores z and the encoder collapses to the prior (KL = 0). The model degenerates to a decoder-only model. Solutions: KL annealing (gradually increase KL weight), beta-VAE, free bits, or using a weaker decoder."
Can you explain what is cosine learning rate scheduling? Be concise and precise.,Cosine scheduling decays the learning rate following a half-cosine curve: LR(t) = LR_min + 0.5*(LR_max - LR_min)*(1 + cos(pi*t/T)). Provides a smooth decay that is large early and small near the end. Widely used in GPT and LLaMA training.
What are embedding models used in RAG? Give examples where relevant.,"Popular models: sentence-transformers all-MiniLM-L6-v2 (fast, 384 dims), E5-large (Microsoft), BGE-M3 (BAAI, multilingual), OpenAI text-embedding-3-large. Embeddings should ideally be fine-tuned for the retrieval domain."
Please describe walk through LoRA fine-tuning step by step. Provide a detailed answer.,"1. Load pretrained model with 4-bit quantization (QLoRA). 2. Define LoraConfig with r=16, alpha=32, targeting q, k, v, o projections. 3. Wrap model with get_peft_model — freezes base weights, adds LoRA matrices. 4. Tokenize dataset in chat format. 5. Train with SFTTrainer — only LoRA params (~0.4%) update. 6. Save the adapter (~50 MB vs 2 GB full model). 7. Merge or load adapter at inference."
Briefly describe what is weight tying in language models?,"Weight tying shares the embedding matrix between the input token embedding layer and the output projection layer (lm_head). Since both map between token space and representation space, sharing weights reduces parameter count and often improves perplexity. Used in GPT-2 and many smaller LLMs."
What is RLHF? For a Generative AI course student.,"RLHF (Ziegler et al., 2019) aligns LLMs with human preferences in three stages: (1) SFT on human-written demonstrations; (2) Reward Model trained on preference pairs; (3) RL optimization (PPO) of the SFT model against the reward model with a KL penalty to prevent reward hacking. Used in InstructGPT and ChatGPT."
Please describe compare LoRA and full fine-tuning. For a Generative AI course student.,Full fine-tuning updates all parameters needing roughly 28 GB GPU for a 7B model. LoRA adds about 0.1-0.4% extra params needing roughly 6 GB. Quality is comparable for most tasks. LoRA adapters are modular and swappable — multiple tasks can share one base model. LoRA also avoids catastrophic forgetting because base weights are frozen.
"In simple terms, what is what is positional encoding? Explain with clear definitions.","Since self-attention is permutation-invariant, positional encoding injects order information. Original Transformer uses fixed sinusoids: PE(pos,2i)=sin(pos/10000^(2i/d)), PE(pos,2i+1)=cos(pos/10000^(2i/d)). BERT/GPT use learned embeddings. LLaMA uses RoPE (Rotary Position Embedding), which applies rotation matrices to Q and K, enabling relative position information and length generalization."
I need help understanding what is flash attention? For a Generative AI course student.,"FlashAttention (Dao et al., 2022) is an IO-aware exact attention algorithm that tiles Q, K, V to avoid materializing the full N by N attention matrix in HBM. Reduces memory from O(N^2) to O(N) and is 2-4x faster due to reduced memory bandwidth. FlashAttention-2 further optimizes parallelism."
Please explain what is PEFT prefix tuning? Explain technically.,"Prefix tuning (Li & Liang, 2021) prepends a sequence of trainable continuous vectors (the prefix) to the key and value matrices at every Transformer layer. Only the prefix parameters are trained; base model is frozen. More expressive than prompt tuning but with more parameters."
Please explain what is ReAct prompting? For a Generative AI course student.,"ReAct (Yao et al., 2022) interleaves Thought (reasoning step), Action (tool call: search or calculator), and Observation (tool result) cycles. The LLM decides what to do, calls a tool, observes the result, and iterates. Grounding reasoning in tool outputs reduces hallucinations. ReAct is the foundation of LLM agent loops."
Please describe compare VAEs and GANs. Explain with clear definitions.,"VAEs maximize a tractable ELBO, producing smoother latent spaces — easier to train and encode/decode. GANs use adversarial training, producing sharper samples. VAEs suffer from blurry reconstructions; GANs suffer from training instability and mode collapse. Both are widely used generative models."
What is Mixture of Experts? Be concise.,MoE replaces the dense FFN in each Transformer block with multiple expert FFNs and a sparse routing mechanism that activates only the top-k experts per token. Increases model capacity without proportional compute increase. Mixtral-8x7B uses MoE and outperforms LLaMA-2 70B with less compute.
I need help understanding what is a diffusion model? Explain technically.,"Diffusion models (DDPM, Ho et al., 2020) define a forward process that adds Gaussian noise over T steps until x_T is approximately N(0,I), then train a neural network to reverse the process by predicting the noise at each step. Sampling involves iterative denoising. DDIM enables faster sampling."
"For a university exam, explain what are embedding models used in RAG? Provide a detailed answer.","Popular models: sentence-transformers all-MiniLM-L6-v2 (fast, 384 dims), E5-large (Microsoft), BGE-M3 (BAAI, multilingual), OpenAI text-embedding-3-large. Embeddings should ideally be fine-tuned for the retrieval domain."
"For a university exam, explain what is flash attention? Provide a detailed answer.","FlashAttention (Dao et al., 2022) is an IO-aware exact attention algorithm that tiles Q, K, V to avoid materializing the full N by N attention matrix in HBM. Reduces memory from O(N^2) to O(N) and is 2-4x faster due to reduced memory bandwidth. FlashAttention-2 further optimizes parallelism."
What are the assessment components of the course? Be concise and precise.,"Assessment breakdown: Assignment 1 (RAG System) 30%, Assignment 2 (Fine-Tuning) 30%, Viva 10%, Mid-semester exam 15%, End-semester exam 15%. Total 100%."
Give a technical explanation of what is full fine-tuning vs PEFT? Explain with clear definitions.,Full fine-tuning updates all model parameters — roughly 28 GB GPU memory for a 7B model at float16. PEFT (Parameter-Efficient Fine-Tuning) freezes most weights and trains a tiny subset. LoRA trains about 0.1-1% extra parameters achieving near full fine-tuning quality at a fraction of memory and compute cost.
What is the difference between BERT and GPT?,"BERT is encoder-only with bidirectional masked language modeling — reads the full sequence, best for understanding tasks (classification, NER, QA extraction). GPT is decoder-only with causal language modeling — generates tokens left to right, best for text generation and in-context learning."
Please describe what is cross-attention? For a Generative AI course student.,"Cross-attention allows the decoder to attend over encoder representations. Q comes from the decoder, K and V come from the encoder. This enables the decoder to look up relevant parts of the encoded input, fundamental in seq2seq tasks like translation."
"In simple terms, what is what is hallucination in LLMs? Be concise and precise.","Hallucination occurs when an LLM generates plausible-sounding but factually incorrect or unsupported content. Types: intrinsic (contradicts source), extrinsic (adds info not in source). Causes: spurious correlations, overconfidence, insufficient grounding. Mitigations: RAG, RLHF, self-consistency, factuality-focused fine-tuning."
What is ReAct prompting? Be concise and precise.,"ReAct (Yao et al., 2022) interleaves Thought (reasoning step), Action (tool call: search or calculator), and Observation (tool result) cycles. The LLM decides what to do, calls a tool, observes the result, and iterates. Grounding reasoning in tool outputs reduces hallucinations. ReAct is the foundation of LLM agent loops."
What is a diffusion model? Give examples where relevant.,"Diffusion models (DDPM, Ho et al., 2020) define a forward process that adds Gaussian noise over T steps until x_T is approximately N(0,I), then train a neural network to reverse the process by predicting the noise at each step. Sampling involves iterative denoising. DDIM enables faster sampling."
I need help understanding what is multi-head attention? Be concise and precise.,"Multi-head attention runs h attention heads in parallel, each with independent W_Q, W_K, W_V projections of dimension d_k = d_model/h. Outputs are concatenated then linearly projected: MultiHead(Q,K,V) = Concat(head_1,...,head_h)W_O. Different heads can attend to different positional and semantic patterns."
What is residual connection? Give examples.,"A residual (skip) connection adds the input of a sublayer directly to its output: y = F(x) + x. This allows gradients to flow directly through the network, mitigating vanishing gradients. Used in every Transformer block around the attention and FFN sublayers. Key to training very deep networks."
Please describe what is Groq? Give examples where relevant.,"Groq is an inference platform with custom LPU hardware delivering extremely fast token generation (200-400 tokens/second). Provides a free API tier supporting LLaMA-3, Mixtral, and Gemma models. Useful for rapid prototyping where low latency matters."
Explain the RAG pipeline step by step. Give examples where relevant.,"1. Ingestion: load and clean documents. 2. Chunking: split into overlapping chunks (e.g., 512 tokens, 50 overlap). 3. Embedding: encode chunks with a sentence-transformer model. 4. Storage: index in ChromaDB or FAISS. 5. Retrieval: embed the query, find top-k similar chunks via ANN. 6. Augmentation: inject retrieved chunks into the LLM prompt. 7. Generation: LLM produces a grounded answer."
"In simple terms, what is when is the assignment submission deadline? Provide a detailed answer.",The combined deadline for Assignment 1 and Assignment 2 is 5th April 2026 at 9:00 PM IST. Demonstrations and Vivas are scheduled after submission.
What is meant by what is Mixture of Experts?,MoE replaces the dense FFN in each Transformer block with multiple expert FFNs and a sparse routing mechanism that activates only the top-k experts per token. Increases model capacity without proportional compute increase. Mixtral-8x7B uses MoE and outperforms LLaMA-2 70B with less compute.
Please explain what is paged AdamW?,"Paged AdamW (bitsandbytes) keeps optimizer states in CPU RAM and pages them to GPU only when needed. Standard AdamW stores moment tensors on GPU (2x model size). Paged AdamW reduces peak GPU memory significantly, enabling larger batch sizes. Used with QLoRA."
Can you explain what is the attention mechanism in neural networks? Explain technically.,"Attention allows a model to weight different parts of the input differently when producing each output element. It computes a context vector as a weighted sum of value vectors, where weights are derived from the similarity between a query and key vectors. Attention removes the bottleneck of fixed-size encodings in seq2seq models."
Define the following: what is a GAN? Include relevant equations or pseudocode if helpful.,"A GAN (Goodfellow et al., 2014) consists of a Generator G(z) that maps noise z to data-like samples, and a Discriminator D(x) that classifies real vs fake. G is trained to fool D; D is trained to distinguish them. At equilibrium, G produces samples indistinguishable from real data."
Can you explain what is re-ranking in RAG?,Re-ranking improves retrieval quality by applying a cross-encoder to re-score the top-k candidates from the bi-encoder. Cross-encoders jointly process query and document and are more accurate but slower. Applied after initial retrieval to improve precision before passing context to the LLM.
Please describe what is LoRA? Include relevant equations or pseudocode if helpful.,"LoRA (Hu et al., 2021) injects trainable low-rank matrices into frozen weight matrices. For W in R^(d x k), LoRA adds delta_W = BA where B is R^(d x r), A is R^(r x k), r much less than min(d,k). The forward pass computes h = Wx + BAx. Only A and B are trained. r=16 with alpha=32 is a common choice."
"In simple terms, what is explain the Transformer architecture. Be concise and precise.","A Transformer (Vaswani et al., 2017) replaces recurrence with attention. Components: token embedding + positional encoding, stacked encoder or decoder blocks each containing multi-head self-attention and a position-wise FFN with residual connections and LayerNorm. Encoder reads full context; decoder adds masked self-attention and cross-attention over encoder output."
What is weight tying in language models?,"Weight tying shares the embedding matrix between the input token embedding layer and the output projection layer (lm_head). Since both map between token space and representation space, sharing weights reduces parameter count and often improves perplexity. Used in GPT-2 and many smaller LLMs."
I need help understanding what is the ELBO? Explain technically.,"ELBO = Evidence Lower BOund = E_q[log p(x|z)] - KL(q(z|x)||p(z)). Maximizing the ELBO simultaneously maximizes reconstruction quality and keeps the approximate posterior q(z|x) close to the prior N(0,I). The ELBO lower-bounds log p(x), so maximizing it indirectly maximizes marginal likelihood."
Can you explain what is residual connection? Explain technically.,"A residual (skip) connection adds the input of a sublayer directly to its output: y = F(x) + x. This allows gradients to flow directly through the network, mitigating vanishing gradients. Used in every Transformer block around the attention and FFN sublayers. Key to training very deep networks."
Briefly describe what is RLHF? Include relevant equations or pseudocode if helpful.,"RLHF (Ziegler et al., 2019) aligns LLMs with human preferences in three stages: (1) SFT on human-written demonstrations; (2) Reward Model trained on preference pairs; (3) RL optimization (PPO) of the SFT model against the reward model with a KL penalty to prevent reward hacking. Used in InstructGPT and ChatGPT."
What is meant by what is cross-attention? Include relevant equations or pseudocode if helpful.,"Cross-attention allows the decoder to attend over encoder representations. Q comes from the decoder, K and V come from the encoder. This enables the decoder to look up relevant parts of the encoded input, fundamental in seq2seq tasks like translation."
What is the difference between GPT-2 and GPT-3? Be concise.,GPT-2 has 1.5B parameters and was pretrained on WebText (~40 GB). GPT-3 scaled to 175B parameters on 300B tokens from Common Crawl and other sources. GPT-3 demonstrated few-shot in-context learning as an emergent capability absent in GPT-2. Scale bridged the gap from a text completer to a general-purpose assistant.
Can you explain what is classifier-free guidance? Give examples where relevant.,"CFG trains a single model for both conditional and unconditional generation by randomly dropping the class condition during training. At inference, the output is extrapolated: output = uncond + w*(cond - uncond) where w > 1 increases adherence to the condition at the cost of diversity. Used in Stable Diffusion."
Please explain what topics are covered in the Generative AI and LLMs course? Explain technically.,"Topics: Generative models (VAE, GAN, Diffusion), Transformer architecture, LLM pretraining, Prompt engineering, Fine-tuning methods (LoRA, QLoRA, RLHF, DPO), RAG systems, Vector databases, Evaluation metrics, and practical deployment on Colab."
"For an AI course student, what is what is the softmax function? Be concise.","Softmax converts a vector of real numbers into a probability distribution: softmax(z_i) = exp(z_i) / sum_j(exp(z_j)). It ensures all outputs are positive and sum to 1. Used in classification heads, attention score normalization, and the final token prediction layer of LLMs."
Define what is the softmax function? Explain with definitions.,"Softmax converts a vector of real numbers into a probability distribution: softmax(z_i) = exp(z_i) / sum_j(exp(z_j)). It ensures all outputs are positive and sum to 1. Used in classification heads, attention score normalization, and the final token prediction layer of LLMs."
Briefly describe what is classifier-free guidance?,"CFG trains a single model for both conditional and unconditional generation by randomly dropping the class condition during training. At inference, the output is extrapolated: output = uncond + w*(cond - uncond) where w > 1 increases adherence to the condition at the cost of diversity. Used in Stable Diffusion."
I need help understanding compare ChromaDB and FAISS.,"ChromaDB is a full-featured vector DB with persistence, metadata filtering, and an easy Python API — best for prototyping and small-to-medium scale. FAISS is a C++ library optimized for billion-scale ANN with IVF and HNSW indexes — faster but lacks built-in persistence and metadata filtering."
Please describe what are BLEU and ROUGE metrics? Provide a detailed answer.,"BLEU (Bilingual Evaluation Understudy) measures n-gram precision between generated and reference text, used mainly for translation. ROUGE (Recall-Oriented Understudy for Gisting Evaluation) measures recall and F1 of n-gram overlap, used mainly for summarization. ROUGE-L uses longest common subsequence. Both are reference-based and miss semantic equivalence."
What are the assessment components of the course?,"Assessment breakdown: Assignment 1 (RAG System) 30%, Assignment 2 (Fine-Tuning) 30%, Viva 10%, Mid-semester exam 15%, End-semester exam 15%. Total 100%."
Define the following: what is beta-VAE? For a Generative AI course student.,"Beta-VAE adds a weight beta > 1 to the KL term: ELBO = reconstruction - beta * KL. Higher beta encourages a more disentangled, information-sparse latent space at the cost of reconstruction quality. It was introduced by Higgins et al. to learn interpretable latent factors."
How does a generative model differ from a discriminative model?,"Discriminative models learn P(y|x)—mapping inputs to labels. Generative models learn the full data distribution P(x) or joint P(x,y), allowing them to sample new examples. Generative models can do more (synthesis, density estimation) but are harder to train."
Briefly describe what is Groq? Explain with clear definitions.,"Groq is an inference platform with custom LPU hardware delivering extremely fast token generation (200-400 tokens/second). Provides a free API tier supporting LLaMA-3, Mixtral, and Gemma models. Useful for rapid prototyping where low latency matters."
Please explain what is the difference between autoregressive and diffusion generation? Explain with clear definitions.,"Autoregressive models (GPT) generate token by token left to right — exact likelihood but sequential and slow for long sequences. Diffusion models denoise from Gaussian noise in T steps — parallel denoising for images, better quality but typically requires many steps. Diffusion-based text generation (e.g., MDLM) is an active research area."
Can you explain what is cross-entropy loss?,"Cross-entropy loss measures the difference between the predicted probability distribution and the true distribution: L = -sum_i y_i * log(p_i). For language modeling, it is the negative log-likelihood of the correct next token. Minimizing cross-entropy is equivalent to maximizing likelihood."
Give a technical explanation of what is ReAct prompting? Explain technically.,"ReAct (Yao et al., 2022) interleaves Thought (reasoning step), Action (tool call: search or calculator), and Observation (tool result) cycles. The LLM decides what to do, calls a tool, observes the result, and iterates. Grounding reasoning in tool outputs reduces hallucinations. ReAct is the foundation of LLM agent loops."
Can you explain what is likelihood-based training? Include relevant equations or pseudocode if helpful.,"Likelihood-based training maximizes log P(x; theta) over the training set. VAEs maximize the ELBO (a lower bound), autoregressive models maximize exact log-likelihood, and normalizing flows maximize exact likelihood via invertible transformations. Diffusion models optimize a variational bound on log-likelihood."
Please explain what is gradient checkpointing?,"Gradient checkpointing reduces activation memory by not storing all intermediate activations during the forward pass. During backprop, discarded activations are recomputed on the fly. Trades about 30% extra compute for a large reduction in memory, enabling larger batch sizes or longer sequences."
What is meant by what topics are covered in the Generative AI and LLMs course? Explain with clear definitions.,"Topics: Generative models (VAE, GAN, Diffusion), Transformer architecture, LLM pretraining, Prompt engineering, Fine-tuning methods (LoRA, QLoRA, RLHF, DPO), RAG systems, Vector databases, Evaluation metrics, and practical deployment on Colab."
Briefly describe what is emergent behavior in LLMs? Include relevant equations or pseudocode if helpful.,"Emergent behaviors are capabilities that appear abruptly as model scale increases, not present in smaller models. Examples: multi-step arithmetic, chain-of-thought reasoning, code generation, instruction following. Emergence is related to phase transitions in the loss landscape. The threshold varies by task."
Can you explain what is beta-VAE? Explain technically.,"Beta-VAE adds a weight beta > 1 to the KL term: ELBO = reconstruction - beta * KL. Higher beta encourages a more disentangled, information-sparse latent space at the cost of reconstruction quality. It was introduced by Higgins et al. to learn interpretable latent factors."
I need help understanding what is the difference between RAG and fine-tuning? For a Generative AI course student.,"RAG retrieves external knowledge at inference without changing weights — ideal for frequently updated facts, private documents, and reducing hallucination. Fine-tuning updates weights on domain data — ideal for style, format, and behavioral changes. RAG has higher inference latency; fine-tuning has higher training cost. They are complementary: fine-tune for format, use RAG for facts."
What is meant by what is DPO? Explain with clear definitions.,"DPO (Direct Preference Optimization, Rafailov et al., 2023) is an RL-free alternative to RLHF. It derives a closed-form optimal policy from the reward model, converting preference learning into a supervised classification objective on (preferred, rejected) pairs. Simpler and more stable than PPO-RLHF."
What is the difference between BERT and GPT?,"BERT is encoder-only with bidirectional masked language modeling — reads the full sequence, powerful for understanding. GPT is decoder-only with causal language modeling — generates tokens left to right, powerful for generation and in-context learning. BERT has no generation capability; GPT can also do understanding via prompting."
Give a technical explanation of what is cosine learning rate scheduling? Explain with clear definitions.,Cosine scheduling decays the learning rate following a half-cosine curve: LR(t) = LR_min + 0.5*(LR_max - LR_min)*(1 + cos(pi*t/T)). Provides a smooth decay that is large early and small near the end. Widely used in GPT and LLaMA training.
Can you explain what is masked self-attention?,"In the decoder, masked self-attention prevents position i from attending to positions j > i (future tokens). This is done by adding -inf to future positions before softmax, ensuring autoregressive generation where each token depends only on past tokens."
Can you explain what is the ELBO?,"ELBO = Evidence Lower BOund = E_q[log p(x|z)] - KL(q(z|x)||p(z)). Maximizing the ELBO simultaneously maximizes reconstruction quality and keeps the approximate posterior q(z|x) close to the prior N(0,I). The ELBO lower-bounds log p(x), so maximizing it indirectly maximizes marginal likelihood."
"For an AI course student, what is what is the softmax function? Provide a detailed answer.","Softmax converts a vector of real numbers into a probability distribution: softmax(z_i) = exp(z_i) / sum_j(exp(z_j)). It ensures all outputs are positive and sum to 1. Used in classification heads, attention score normalization, and the final token prediction layer of LLMs."
"In simple terms, what is explain Chain-of-Thought prompting. Explain with clear definitions.","CoT prompting (Wei et al., 2022) elicits step-by-step reasoning before the final answer. Zero-shot CoT adds ""Let us think step by step."" Few-shot CoT provides worked-out reasoning examples. CoT dramatically improves multi-step arithmetic, commonsense, and symbolic reasoning. It enables models to decompose problems and check intermediate steps."
What is meant by what is self-attention and how is it computed? Give examples where relevant.,"Self-attention projects input X into Q=XW_Q, K=XW_K, V=XW_V. Attention(Q,K,V) = softmax(QK^T / sqrt(d_k)) V. Scaling by sqrt(d_k) prevents softmax saturation. Output is a weighted sum of values, with weights reflecting token-to-token relevance. Complexity is O(n^2 d)."
Please describe what is beta-VAE?,"Beta-VAE adds a weight beta > 1 to the KL term: ELBO = reconstruction - beta * KL. Higher beta encourages a more disentangled, information-sparse latent space at the cost of reconstruction quality. It was introduced by Higgins et al. to learn interpretable latent factors."
