instruction,output
"As an AI student, explain what is RLHF? Provide a detailed answer.","RLHF (Ziegler et al., 2019) aligns LLMs with human preferences in three stages: (1) SFT on human-written demonstrations; (2) Reward Model trained on preference pairs; (3) RL optimization (PPO) of the SFT model against the reward model with a KL penalty to prevent reward hacking. Used in InstructGPT and ChatGPT."
What is self-consistency prompting? Give examples where relevant.,"Self-consistency (Wang et al., 2022) samples multiple diverse CoT reasoning paths for the same question and takes a majority vote on the final answer. Accuracy improves with more samples. It exploits the fact that correct reasoning paths tend to converge on the correct answer while incorrect paths diverge."
Walk through LoRA fine-tuning step by step. Explain technically.,"1. Load pretrained model with 4-bit quantization (QLoRA). 2. Define LoraConfig with r=16, alpha=32, targeting q, k, v, o projections. 3. Wrap model with get_peft_model — freezes base weights, adds LoRA matrices. 4. Tokenize dataset in chat format. 5. Train with SFTTrainer — only LoRA params (~0.4%) update. 6. Save the adapter (~50 MB vs 2 GB full model). 7. Merge or load adapter at inference."
Define the following: what is mode collapse in GANs and how do you fix it? Provide a detailed answer.,"Mode collapse: G maps all inputs to a small subset of modes, ignoring data diversity. Fixes: (1) Wasserstein GAN — uses Earth Mover distance with gradient penalty; (2) mini-batch discrimination — D sees statistics across a batch; (3) progressive growing — train at increasing resolutions; (4) spectral normalization of D weights."
What is the PEFT library? Include relevant equations or pseudocode if helpful.,"PEFT by HuggingFace simplifies applying LoRA, prefix tuning, prompt tuning, and IA3 to any HuggingFace model. Key functions: LoraConfig, get_peft_model (wraps model and freezes base), PeftModel.from_pretrained (loads adapter). Integrates with Trainer and SFTTrainer."
What is mode collapse in GANs and how do you fix it? Include relevant equations or pseudocode if helpful.,"Mode collapse: G maps all inputs to a small subset of modes, ignoring data diversity. Fixes: (1) Wasserstein GAN — uses Earth Mover distance with gradient penalty; (2) mini-batch discrimination — D sees statistics across a batch; (3) progressive growing — train at increasing resolutions; (4) spectral normalization of D weights."
Please explain what is Layer Normalization? Include relevant equations or pseudocode if helpful.,"LayerNorm normalizes activations across the feature dimension for each token independently: y = (x - mean) / (std + eps) * gamma + beta. Unlike BatchNorm, it does not depend on batch size, making it suitable for variable-length sequences. Pre-LN (applied before attention) is more stable than post-LN."
What is Layer Normalization?,"LayerNorm normalizes activations across the feature dimension for each token independently: y = (x - mean) / (std + eps) * gamma + beta. Unlike BatchNorm, it does not depend on batch size, making it suitable for variable-length sequences. Pre-LN (applied before attention) is more stable than post-LN."
"Give a technical explanation of compare encoder-only, decoder-only, and encoder-decoder Transformers.","Encoder-only (BERT): bidirectional context, masked LM pretraining, best for understanding (classification, NER). Decoder-only (GPT, LLaMA): causal attention, next-token prediction, best for generation and in-context learning. Encoder-decoder (T5, BART): full bidirectional encoding plus autoregressive decoding, best for seq2seq tasks like translation."
"As an AI student, explain what is the difference between autoregressive and diffusion generation? Include relevant equations or pseudocode if helpful.","Autoregressive models (GPT) generate token by token left to right — exact likelihood but sequential and slow for long sequences. Diffusion models denoise from Gaussian noise in T steps — parallel denoising for images, better quality but typically requires many steps. Diffusion-based text generation (e.g., MDLM) is an active research area."
What is a Wasserstein GAN? Be concise and precise.,WGAN replaces the JS divergence with Earth Mover (Wasserstein-1) distance. The discriminator (now called critic) outputs an unbounded score. Training requires weight clipping or a gradient penalty (WGAN-GP) to enforce the Lipschitz constraint. WGAN provides a meaningful loss metric correlated with sample quality.
What is the forward and reverse process in diffusion models? Be concise and precise.,"Forward: q(x_t|x_{t-1}) = N(x_t; sqrt(1-beta_t)*x_{t-1}, beta_t*I) adds Gaussian noise at each step. Reverse: learned p_theta(x_{t-1}|x_t) denoises step by step. The network predicts the noise epsilon_theta(x_t, t) and the loss is MSE between predicted and actual noise."
"For a university exam, explain what is the reparameterization trick in VAEs?","Sampling z ~ N(mu, sigma^2) is non-differentiable. The reparameterization trick rewrites z = mu + sigma * epsilon where epsilon ~ N(0,1). Gradients flow through mu and sigma deterministically; epsilon carries the randomness. This enables backpropagation through the sampling step."
"As an AI student, explain what is T5?","T5 (Text-to-Text Transfer Transformer, Raffel et al., 2020) frames all NLP tasks as text-to-text. The input is a prefixed instruction and output is text. Uses encoder-decoder architecture. Trained on C4 (Colossal Clean Crawled Corpus). Unifies classification, summarization, translation, and QA in one model."
Can you explain what is perplexity and how is it interpreted?,Perplexity = exp(-1/N * sum_i log P(w_i|context)). Lower perplexity means the model assigns higher probability to test text — it is less surprised. A perplexity of k means the model is as uncertain as a uniform distribution over k choices per token. It is an intrinsic metric and may not directly predict downstream performance.
"For a university exam, explain what is paged AdamW? Provide a detailed answer.","Paged AdamW (bitsandbytes) keeps optimizer states in CPU RAM and pages them to GPU only when needed. Standard AdamW stores moment tensors on GPU (2x model size). Paged AdamW reduces peak GPU memory significantly, enabling larger batch sizes. Used with QLoRA."
Define the following: what is zero-shot vs few-shot prompting? Provide a detailed answer.,"Zero-shot: only a task instruction, no examples, relying purely on pretrained knowledge. Few-shot (Brown et al., 2020): k input-output demonstrations prepended to the actual query. Few-shot guides the output format and style through examples. Neither involves weight updates — both are in-context learning."
What is the forward and reverse process in diffusion models?,"Forward: q(x_t|x_{t-1}) = N(x_t; sqrt(1-beta_t)*x_{t-1}, beta_t*I) adds Gaussian noise at each step. Reverse: learned p_theta(x_{t-1}|x_t) denoises step by step. The network predicts the noise epsilon_theta(x_t, t) and the loss is MSE between predicted and actual noise."
Briefly describe what is catastrophic forgetting in fine-tuning? Be concise and precise.,"When a model is fine-tuned on a new task, it may overwrite representations needed for old tasks. Mitigations: PEFT (original weights frozen), elastic weight consolidation (EWC), rehearsal (mixing old data), continual learning methods. LoRA avoids forgetting because base weights are not modified."
"As an AI student, explain what is perplexity and how is it interpreted?",Perplexity = exp(-1/N * sum_i log P(w_i|context)). Lower perplexity means the model assigns higher probability to test text — it is less surprised. A perplexity of k means the model is as uncertain as a uniform distribution over k choices per token. It is an intrinsic metric and may not directly predict downstream performance.
"As an AI student, explain what is the Tree of Thoughts framework?","Tree of Thoughts (Yao et al., 2023) frames problem solving as a search over a tree of coherent text chunks. The model generates multiple thoughts at each node, evaluates their promise, and applies BFS or DFS to navigate the tree. Dramatically outperforms CoT on tasks requiring exploration and backtracking."
What is the attention mechanism in neural networks? Explain with definitions.,"Attention allows a model to weight different parts of the input differently when producing each output element. It computes a context vector as a weighted sum of value vectors, where weights are derived from the similarity between a query and key vectors. Attention removes the bottleneck of fixed-size encodings in seq2seq models."
What is the posterior collapse problem in VAEs? Give examples where relevant.,"Posterior collapse occurs when the decoder ignores z and the encoder collapses to the prior (KL = 0). The model degenerates to a decoder-only model. Solutions: KL annealing (gradually increase KL weight), beta-VAE, free bits, or using a weaker decoder."
Give a technical explanation of what is Mixture of Experts?,MoE replaces the dense FFN in each Transformer block with multiple expert FFNs and a sparse routing mechanism that activates only the top-k experts per token. Increases model capacity without proportional compute increase. Mixtral-8x7B uses MoE and outperforms LLaMA-2 70B with less compute.
Please describe what is QLoRA? Include relevant equations or pseudocode if helpful.,"QLoRA (Dettmers et al., 2023) combines 4-bit NF4 (NormalFloat4) quantization of the frozen base model with LoRA adapters trained in bfloat16. Double quantization further compresses quantization constants. With paged optimizers, a 7B model can be fine-tuned on a single 16 GB T4 GPU. Quality is close to 16-bit LoRA."
I need help understanding what is dropout regularization? Be concise.,"Dropout randomly sets a fraction p of neurons to zero during training, forcing the network to learn redundant representations. Acts as an ensemble of many sub-networks. Reduces overfitting on small datasets. At inference, all neurons are active and outputs are scaled by (1-p). Less commonly used in modern LLMs."
What is the difference between autoregressive and diffusion generation? Explain with clear definitions.,"Autoregressive models (GPT) generate token by token left to right — exact likelihood but sequential and slow for long sequences. Diffusion models denoise from Gaussian noise in T steps — parallel denoising for images, better quality but typically requires many steps. Diffusion-based text generation (e.g., MDLM) is an active research area."
"For a university exam, explain what is re-ranking in RAG?",Re-ranking improves retrieval quality by applying a cross-encoder to re-score the top-k candidates from the bi-encoder. Cross-encoders jointly process query and document and are more accurate but slower. Applied after initial retrieval to improve precision before passing context to the LLM.
"In simple terms, what is what is gradient checkpointing?","Gradient checkpointing reduces activation memory by not storing all intermediate activations during the forward pass. During backprop, discarded activations are recomputed on the fly. Trades about 30% extra compute for a large reduction in memory, enabling larger batch sizes or longer sequences."
"For a university exam, explain what are chunking strategies for RAG? Give examples where relevant.","Strategies: (1) Fixed-size with overlap (e.g., 512 tokens, 50-token overlap) — simple but may split sentences; (2) Recursive character splitting — splits at paragraphs, then sentences, then words; (3) Semantic chunking — splits when embedding similarity drops; (4) Document-structure-aware — splits at headers/sections. Overlap prevents context loss at chunk boundaries."
"As an AI student, explain what are evaluation metrics for GANs?",FID (Frechet Inception Distance) computes Frechet distance between real and generated feature distributions in Inception space — lower is better. IS (Inception Score) measures quality and diversity. Precision/Recall for generative models decomposes IS into quality (precision) and diversity (recall).
Please describe what is mode collapse in GANs and how do you fix it?,"Mode collapse: G maps all inputs to a small subset of modes, ignoring data diversity. Fixes: (1) Wasserstein GAN — uses Earth Mover distance with gradient penalty; (2) mini-batch discrimination — D sees statistics across a batch; (3) progressive growing — train at increasing resolutions; (4) spectral normalization of D weights."
I need help understanding what is Layer Normalization?,"LayerNorm normalizes activations across the feature dimension for each token independently: y = (x - mean) / (std + eps) * gamma + beta. Unlike BatchNorm, it does not depend on batch size, making it suitable for variable-length sequences. Pre-LN (applied before attention) is more stable than post-LN."
"For a university exam, explain what is instruction tuning? Give examples where relevant.","Instruction tuning fine-tunes LLMs on diverse (instruction, output) pairs covering many tasks. Models learn to follow natural language instructions zero-shot. FLAN, Alpaca, Vicuna, and OpenHermes are examples. Instruction tuning drastically improves zero-shot generalization across unseen tasks."
What is prompt tuning? Explain technically.,"Prompt tuning (Lester et al., 2021) prepends a small number of trainable token embeddings to the input at the embedding layer. The rest of the model is frozen. Simpler than prefix tuning. Performance approaches full fine-tuning at large model scales (10B+ parameters)."
"As an AI student, explain what is mode collapse in GANs and how do you fix it? Explain with clear definitions.","Mode collapse: G maps all inputs to a small subset of modes, ignoring data diversity. Fixes: (1) Wasserstein GAN — uses Earth Mover distance with gradient penalty; (2) mini-batch discrimination — D sees statistics across a batch; (3) progressive growing — train at increasing resolutions; (4) spectral normalization of D weights."
"As an AI student, explain what is the Tree of Thoughts framework?","Tree of Thoughts (Yao et al., 2023) frames problem solving as a search over a tree of coherent text chunks. The model generates multiple thoughts at each node, evaluates their promise, and applies BFS or DFS to navigate the tree. Dramatically outperforms CoT on tasks requiring exploration and backtracking."
What is meant by what is the difference between BERT and GPT? Provide a detailed answer.,"BERT is encoder-only with bidirectional masked language modeling — reads the full sequence, powerful for understanding. GPT is decoder-only with causal language modeling — generates tokens left to right, powerful for generation and in-context learning. BERT has no generation capability; GPT can also do understanding via prompting."
Can you explain what is cross-entropy loss? Give examples.,"Cross-entropy loss measures the difference between the predicted probability distribution and the true distribution: L = -sum_i y_i * log(p_i). For language modeling, it is the negative log-likelihood of the correct next token. Minimizing cross-entropy is equivalent to maximizing likelihood."
Compare LoRA and full fine-tuning.,Full fine-tuning updates all parameters needing roughly 28 GB GPU for a 7B model. LoRA adds about 0.1-0.4% extra params needing roughly 6 GB. Quality is comparable for most tasks. LoRA adapters are modular and swappable — multiple tasks can share one base model. LoRA also avoids catastrophic forgetting because base weights are frozen.
Give a technical explanation of what is the Tree of Thoughts framework? Include relevant equations or pseudocode if helpful.,"Tree of Thoughts (Yao et al., 2023) frames problem solving as a search over a tree of coherent text chunks. The model generates multiple thoughts at each node, evaluates their promise, and applies BFS or DFS to navigate the tree. Dramatically outperforms CoT on tasks requiring exploration and backtracking."
What is meant by what is the difference between pretraining and fine-tuning? Provide a detailed answer.,"Pretraining learns general representations from massive unlabeled corpora via self-supervised objectives (next-token prediction, masked LM). Fine-tuning adapts the pretrained model to a specific task on a smaller labeled dataset, updating all or a subset of weights. Fine-tuning is much cheaper than pretraining from scratch."
I need help understanding what is a diffusion model?,"Diffusion models (DDPM, Ho et al., 2020) define a forward process that adds Gaussian noise over T steps until x_T is approximately N(0,I), then train a neural network to reverse the process by predicting the noise at each step. Sampling involves iterative denoising. DDIM enables faster sampling."
What is PEFT prefix tuning? Explain technically.,"Prefix tuning (Li & Liang, 2021) prepends a sequence of trainable continuous vectors (the prefix) to the key and value matrices at every Transformer layer. Only the prefix parameters are trained; base model is frozen. More expressive than prompt tuning but with more parameters."
"For an AI course student, what is what is prompt tuning? Explain with definitions.","Prompt tuning (Lester et al., 2021) prepends a small number of trainable token embeddings to the input at the embedding layer. The rest of the model is frozen. Simpler than prefix tuning. Performance approaches full fine-tuning at large model scales (10B+ parameters)."
Define the following: what is catastrophic forgetting in fine-tuning? Provide a detailed answer.,"When a model is fine-tuned on a new task, it may overwrite representations needed for old tasks. Mitigations: PEFT (original weights frozen), elastic weight consolidation (EWC), rehearsal (mixing old data), continual learning methods. LoRA avoids forgetting because base weights are not modified."
What are the main families of generative models? Provide a detailed answer.,"The four main families are: (1) GANs — adversarial generator-discriminator training; (2) VAEs — encoder-decoder with a probabilistic latent space; (3) Diffusion models — iterative denoising from Gaussian noise; (4) Autoregressive models — predict the next token given previous tokens (e.g., GPT)."
Briefly describe what is gradient checkpointing? For a Generative AI course student.,"Gradient checkpointing reduces activation memory by not storing all intermediate activations during the forward pass. During backprop, discarded activations are recomputed on the fly. Trades about 30% extra compute for a large reduction in memory, enabling larger batch sizes or longer sequences."
What is meant by what is prompt engineering?,"Prompt engineering designs input prompts to elicit desired LLM outputs. Techniques: zero-shot (direct instruction), few-shot (k demonstrations), chain-of-thought (step-by-step reasoning), system prompts (role/persona), structured output prompting (JSON schema), self-consistency (majority vote over multiple CoT paths)."
I need help understanding what is LangChain?,"LangChain is a framework for building LLM applications. Core abstractions: Chains (sequential LLM calls), Agents (LLM selects tools), Memory (conversation history), Tools (external APIs), Vector stores (for RAG). Supports OpenAI, Anthropic, Groq, Ollama, and HuggingFace backends."
What topics are covered in the Generative AI and LLMs course?,"Topics: Generative models (VAE, GAN, Diffusion), Transformer architecture, LLM pretraining, Prompt engineering, Fine-tuning methods (LoRA, QLoRA, RLHF, DPO), RAG systems, Vector databases, Evaluation metrics, and practical deployment on Colab."
Give a technical explanation of what are BLEU and ROUGE metrics? Give examples where relevant.,"BLEU (Bilingual Evaluation Understudy) measures n-gram precision between generated and reference text, used mainly for translation. ROUGE (Recall-Oriented Understudy for Gisting Evaluation) measures recall and F1 of n-gram overlap, used mainly for summarization. ROUGE-L uses longest common subsequence. Both are reference-based and miss semantic equivalence."
"For a university exam, explain what is the difference between pretraining and fine-tuning?","Pretraining learns general representations from massive unlabeled corpora via self-supervised objectives (next-token prediction, masked LM). Fine-tuning adapts the pretrained model to a specific task on a smaller labeled dataset, updating all or a subset of weights. Fine-tuning is much cheaper than pretraining from scratch."
What are embedding models used in RAG? Provide a detailed answer.,"Popular models: sentence-transformers all-MiniLM-L6-v2 (fast, 384 dims), E5-large (Microsoft), BGE-M3 (BAAI, multilingual), OpenAI text-embedding-3-large. Embeddings should ideally be fine-tuned for the retrieval domain."
What is a GAN? Explain with clear definitions.,"A GAN (Goodfellow et al., 2014) consists of a Generator G(z) that maps noise z to data-like samples, and a Discriminator D(x) that classifies real vs fake. G is trained to fool D; D is trained to distinguish them. At equilibrium, G produces samples indistinguishable from real data."
"In simple terms, what is what topics are covered in the Generative AI and LLMs course? Explain with clear definitions.","Topics: Generative models (VAE, GAN, Diffusion), Transformer architecture, LLM pretraining, Prompt engineering, Fine-tuning methods (LoRA, QLoRA, RLHF, DPO), RAG systems, Vector databases, Evaluation metrics, and practical deployment on Colab."
Give a technical explanation of what are the course prerequisites? Be concise and precise.,"Prerequisites: intermediate Python, basic ML concepts (loss functions, gradient descent), linear algebra (matrix operations, eigenvalues), probability and statistics (distributions, Bayes theorem, MLE)."
I need help understanding what is dropout regularization?,"Dropout randomly sets a fraction p of neurons to zero during training, forcing the network to learn redundant representations. Acts as an ensemble of many sub-networks. Reduces overfitting on small datasets. At inference, all neurons are active and outputs are scaled by (1-p). Less commonly used in modern LLMs."
Can you explain when is the assignment submission deadline? Include relevant equations or pseudocode if helpful.,The combined deadline for Assignment 1 and Assignment 2 is 5th April 2026 at 9:00 PM IST. Demonstrations and Vivas are scheduled after submission.
What is the PEFT library? Include relevant equations or pseudocode if helpful.,"PEFT by HuggingFace simplifies applying LoRA, prefix tuning, prompt tuning, and IA3 to any HuggingFace model. Key functions: LoraConfig, get_peft_model (wraps model and freezes base), PeftModel.from_pretrained (loads adapter). Integrates with Trainer and SFTTrainer."
What is meant by what is positional encoding?,"Since self-attention is permutation-invariant, positional encoding injects order information. Original Transformer uses fixed sinusoids: PE(pos,2i)=sin(pos/10000^(2i/d)), PE(pos,2i+1)=cos(pos/10000^(2i/d)). BERT/GPT use learned embeddings. LLaMA uses RoPE (Rotary Position Embedding), which applies rotation matrices to Q and K, enabling relative position information and length generalization."
"As an AI student, explain what is cosine learning rate scheduling? Explain technically.",Cosine scheduling decays the learning rate following a half-cosine curve: LR(t) = LR_min + 0.5*(LR_max - LR_min)*(1 + cos(pi*t/T)). Provides a smooth decay that is large early and small near the end. Widely used in GPT and LLaMA training.
Compare LoRA and full fine-tuning. Be concise and precise.,Full fine-tuning updates all parameters needing roughly 28 GB GPU for a 7B model. LoRA adds about 0.1-0.4% extra params needing roughly 6 GB. Quality is comparable for most tasks. LoRA adapters are modular and swappable — multiple tasks can share one base model. LoRA also avoids catastrophic forgetting because base weights are frozen.
"In simple terms, what is what is positional encoding?","Since self-attention is permutation-invariant, positional encoding injects order information. Original Transformer uses fixed sinusoids: PE(pos,2i)=sin(pos/10000^(2i/d)), PE(pos,2i+1)=cos(pos/10000^(2i/d)). BERT/GPT use learned embeddings. LLaMA uses RoPE (Rotary Position Embedding), which applies rotation matrices to Q and K, enabling relative position information and length generalization."
What is meant by what tools and platforms are used in the course labs?,"Platform: Google Colab (free T4 GPU). Frameworks: HuggingFace Transformers, PEFT, TRL, Datasets. LLM access: Groq API and Ollama. Vector databases: ChromaDB and FAISS. Embeddings: sentence-transformers. Optional: Weights and Biases for experiment tracking."
"In simple terms, what is what are embedding models used in RAG? Provide a detailed answer.","Popular models: sentence-transformers all-MiniLM-L6-v2 (fast, 384 dims), E5-large (Microsoft), BGE-M3 (BAAI, multilingual), OpenAI text-embedding-3-large. Embeddings should ideally be fine-tuned for the retrieval domain."
I need help understanding what is masked self-attention? Explain technically.,"In the decoder, masked self-attention prevents position i from attending to positions j > i (future tokens). This is done by adding -inf to future positions before softmax, ensuring autoregressive generation where each token depends only on past tokens."
What is a language model?,"A language model assigns probabilities to sequences of tokens: P(w_1, w_2, ..., w_n). Modern neural language models are trained via next-token prediction: P(w_t | w_1, ..., w_{t-1}). They can generate text by sampling from the learned distribution. LLMs are very large language models trained on internet-scale data."
